<?xml version="1.0" encoding="UTF-8"?>
<xs:schema xmlns:xs="http://www.w3.org/2001/XMLSchema" 
		targetNamespace="http://www.example.org/exportBase" 
		xmlns:tns="http://www.example.org/exportBase" elementFormDefault="qualified">
	<xs:element name="data">
		<xs:complexType>
			<xs:sequence>
			<xs:element name="table" minOccurs="1" maxOccurs="unbounded">
					<xs:complexType>
						<xs:sequence>
							<xs:element name="columns">
								<xs:complexType>
									<xs:sequence>
										<xs:element name="column" minOccurs="1" maxOccurs="unbounded">
											<xs:complexType>
												<xs:attribute name="name" type="xs:string" />
												<xs:attribute name="type" type="xs:string" />
											</xs:complexType>
										</xs:element>
									</xs:sequence>
								</xs:complexType>
							</xs:element>
							<xs:element name="rows" >
								<xs:complexType>
									<xs:sequence>
										<xs:element name="row" minOccurs="0" maxOccurs="unbounded">
								<xs:complexType>
									<xs:sequence>
										<xs:element name="cell" minOccurs="1" maxOccurs="unbounded">
											<xs:complexType>
												<xs:simpleContent>
													<xs:extension base="xs:string">
														<xs:attribute name="name" type="xs:string" />
													</xs:extension>
												</xs:simpleContent>
											</xs:complexType>
										</xs:element>
									</xs:sequence>
								</xs:complexType>
							</xs:element>
									</xs:sequence>
								</xs:complexType>
							</xs:element>
							
						</xs:sequence>
						<xs:attribute name="name" type="xs:string"></xs:attribute>
					</xs:complexType>
				</xs:element>
			</xs:sequence>
		</xs:complexType>
	</xs:element>
</xs:schema>